{"basic": {"description": "Detect percussive note onsets by identifying broadband energy rises", "identifier": "percussiononsets", "name": "Simple Percussion Onset Detector"}, "basicOutputInfo": [{"description": "Percussive note onset locations", "identifier": "onsets", "name": "Onsets"}, {"description": "Broadband energy rise detection function", "identifier": "detectionfunction", "name": "Detection Function"}], "category": ["Time", "Onsets"], "copyright": "Code copyright 2006 Queen Mary, University of London, after Dan Barry et al 2005.  Freely redistributable (BSD license)", "inputDomain": "FrequencyDomain", "pluginKey": "vamp-example-plugins:percussiononsets", "maker": "Vamp SDK Example Plugins", "maxChannelCount": 1, "minChannelCount": 1, "parameters": [{"basic": {"description": "Energy rise within a frequency bin necessary to count toward broadband total", "identifier": "threshold", "name": "Energy rise threshold"}, "defaultValue": 3, "extents": {"max": 20, "min": 0}, "unit": "dB", "valueNames": []}, {"basic": {"description": "Sensitivity of peak detector applied to broadband detection function", "identifier": "sensitivity", "name": "Sensitivity"}, "defaultValue": 40, "extents": {"max": 100, "min": 0}, "unit": "%", "valueNames": []}], "programs": [], "pluginVersion": 2}
